imx500-implementation/outputs/summary.json

[
  {
    "tag": "baseline_5x5_fp32",
    "model": "baseline_5x5",
    "checkpoint": "/Users/alexandre/Documents/ETHZ/Machine Learning on Microcontrollers FS2026/Project/ml-on-microcontrollers/pc-implementation/trained_models_2/baseline_5x5_fp32.pt",
    "output_dir": "/Users/alexandre/Documents/ETHZ/Machine Learning on Microcontrollers FS2026/Project/ml-on-microcontrollers/imx500-implementation/outputs/models/baseline_5x5_fp32",
    "export_path": "/Users/alexandre/Documents/ETHZ/Machine Learning on Microcontrollers FS2026/Project/ml-on-microcontrollers/imx500-implementation/outputs/onnx/baseline_5x5_fp32_imx500_ptq.onnx",
    "params": 89578,
    "weight_kib_fp32": 349.9140625,
    "weight_kib_int8": 87.478515625,
    "macs": 12298240,
    "ops_paper_convention": 24596480,
    "tpc_fw_name": "pytorch",
    "tpc_target_platform": "imx500",
    "tpc_version": "v1",
    "quantization_info": "<model_compression_toolkit.core.common.user_info.UserInformation object at 0x14baf7310>",
    "fp32_test_acc": 0.7979,
    "fp32_mAP": 0.8818263890642151,
    "int8_test_acc": 0.7983,
    "int8_mAP": 0.8819809023049074
  },
  {
    "tag": "baseline_5x5_fp32_ptq",
    "model": "baseline_5x5",
    "checkpoint": "/Users/alexandre/Documents/ETHZ/Machine Learning on Microcontrollers FS2026/Project/ml-on-microcontrollers/pc-implementation/trained_models_2/baseline_5x5_fp32_ptq.pt",
    "output_dir": "/Users/alexandre/Documents/ETHZ/Machine Learning on Microcontrollers FS2026/Project/ml-on-microcontrollers/imx500-implementation/outputs/models/baseline_5x5_fp32_ptq",
    "export_path": "/Users/alexandre/Documents/ETHZ/Machine Learning on Microcontrollers FS2026/Project/ml-on-microcontrollers/imx500-implementation/outputs/onnx/baseline_5x5_fp32_ptq_imx500_ptq.onnx",
    "params": 89578,
    "weight_kib_fp32": 349.9140625,
    "weight_kib_int8": 87.478515625,
    "macs": 12298240,
    "ops_paper_convention": 24596480,
    "tpc_fw_name": "pytorch",
    "tpc_target_platform": "imx500",
    "tpc_version": "v1",
    "quantization_info": "<model_compression_toolkit.core.common.user_info.UserInformation object at 0x14bc1cad0>",
    "fp32_test_acc": 0.7985,
    "fp32_mAP": 0.8806247104387068,
    "int8_test_acc": 0.7977,
    "int8_mAP": 0.8798992477067108
  },
  {
    "tag": "baseline_5x5_qat",
    "model": "baseline_5x5",
    "checkpoint": "/Users/alexandre/Documents/ETHZ/Machine Learning on Microcontrollers FS2026/Project/ml-on-microcontrollers/pc-implementation/trained_models_2/baseline_5x5_qat.pt",
    "output_dir": "/Users/alexandre/Documents/ETHZ/Machine Learning on Microcontrollers FS2026/Project/ml-on-microcontrollers/imx500-implementation/outputs/models/baseline_5x5_qat",
    "export_path": "/Users/alexandre/Documents/ETHZ/Machine Learning on Microcontrollers FS2026/Project/ml-on-microcontrollers/imx500-implementation/outputs/onnx/baseline_5x5_qat_imx500_ptq.onnx",
    "params": 89578,
    "weight_kib_fp32": 349.9140625,
    "weight_kib_int8": 87.478515625,
    "macs": 12298240,
    "ops_paper_convention": 24596480,
    "tpc_fw_name": "pytorch",
    "tpc_target_platform": "imx500",
    "tpc_version": "v1",
    "quantization_info": "<model_compression_toolkit.core.common.user_info.UserInformation object at 0x149c57510>",
    "fp32_test_acc": 0.8114,
    "fp32_mAP": 0.8931961196535928,
    "int8_test_acc": 0.8104,
    "int8_mAP": 0.8929957888856446
  },
  {
    "tag": "baseline_fp32",
    "model": "baseline",
    "checkpoint": "/Users/alexandre/Documents/ETHZ/Machine Learning on Microcontrollers FS2026/Project/ml-on-microcontrollers/pc-implementation/trained_models_2/baseline_fp32.pt",
    "output_dir": "/Users/alexandre/Documents/ETHZ/Machine Learning on Microcontrollers FS2026/Project/ml-on-microcontrollers/imx500-implementation/outputs/models/baseline_fp32",
    "export_path": "/Users/alexandre/Documents/ETHZ/Machine Learning on Microcontrollers FS2026/Project/ml-on-microcontrollers/imx500-implementation/outputs/onnx/baseline_fp32_imx500_ptq.onnx",
    "params": 38890,
    "weight_kib_fp32": 151.9140625,
    "weight_kib_int8": 37.978515625,
    "macs": 4433920,
    "ops_paper_convention": 8867840,
    "tpc_fw_name": "pytorch",
    "tpc_target_platform": "imx500",
    "tpc_version": "v1",
    "quantization_info": "<model_compression_toolkit.core.common.user_info.UserInformation object at 0x149c98f50>",
    "fp32_test_acc": 0.8098,
    "fp32_mAP": 0.888341826141471,
    "int8_test_acc": 0.8073,
    "int8_mAP": 0.8874083602384207
  },
  {
    "tag": "baseline_fp32_ptq",
    "model": "baseline",
    "checkpoint": "/Users/alexandre/Documents/ETHZ/Machine Learning on Microcontrollers FS2026/Project/ml-on-microcontrollers/pc-implementation/trained_models_2/baseline_fp32_ptq.pt",
    "output_dir": "/Users/alexandre/Documents/ETHZ/Machine Learning on Microcontrollers FS2026/Project/ml-on-microcontrollers/imx500-implementation/outputs/models/baseline_fp32_ptq",
    "export_path": "/Users/alexandre/Documents/ETHZ/Machine Learning on Microcontrollers FS2026/Project/ml-on-microcontrollers/imx500-implementation/outputs/onnx/baseline_fp32_ptq_imx500_ptq.onnx",
    "params": 38890,
    "weight_kib_fp32": 151.9140625,
    "weight_kib_int8": 37.978515625,
    "macs": 4433920,
    "ops_paper_convention": 8867840,
    "tpc_fw_name": "pytorch",
    "tpc_target_platform": "imx500",
    "tpc_version": "v1",
    "quantization_info": "<model_compression_toolkit.core.common.user_info.UserInformation object at 0x15744e250>",
    "fp32_test_acc": 0.8091,
    "fp32_mAP": 0.8880271330868702,
    "int8_test_acc": 0.8077,
    "int8_mAP": 0.8874575693789529
  },
  {
    "tag": "baseline_qat",
    "model": "baseline",
    "checkpoint": "/Users/alexandre/Documents/ETHZ/Machine Learning on Microcontrollers FS2026/Project/ml-on-microcontrollers/pc-implementation/trained_models_2/baseline_qat.pt",
    "output_dir": "/Users/alexandre/Documents/ETHZ/Machine Learning on Microcontrollers FS2026/Project/ml-on-microcontrollers/imx500-implementation/outputs/models/baseline_qat",
    "export_path": "/Users/alexandre/Documents/ETHZ/Machine Learning on Microcontrollers FS2026/Project/ml-on-microcontrollers/imx500-implementation/outputs/onnx/baseline_qat_imx500_ptq.onnx",
    "params": 38890,
    "weight_kib_fp32": 151.9140625,
    "weight_kib_int8": 37.978515625,
    "macs": 4433920,
    "ops_paper_convention": 8867840,
    "tpc_fw_name": "pytorch",
    "tpc_target_platform": "imx500",
    "tpc_version": "v1",
    "quantization_info": "<model_compression_toolkit.core.common.user_info.UserInformation object at 0x14bc74690>",
    "fp32_test_acc": 0.8115,
    "fp32_mAP": 0.891632195755761,
    "int8_test_acc": 0.8094,
    "int8_mAP": 0.8912749800065599
  },
  {
    "tag": "deeper_fp32",
    "model": "deeper",
    "checkpoint": "/Users/alexandre/Documents/ETHZ/Machine Learning on Microcontrollers FS2026/Project/ml-on-microcontrollers/pc-implementation/trained_models_2/deeper_fp32.pt",
    "output_dir": "/Users/alexandre/Documents/ETHZ/Machine Learning on Microcontrollers FS2026/Project/ml-on-microcontrollers/imx500-implementation/outputs/models/deeper_fp32",
    "export_path": "/Users/alexandre/Documents/ETHZ/Machine Learning on Microcontrollers FS2026/Project/ml-on-microcontrollers/imx500-implementation/outputs/onnx/deeper_fp32_imx500_ptq.onnx",
    "params": 141034,
    "weight_kib_fp32": 550.9140625,
    "weight_kib_int8": 137.728515625,
    "macs": 7963904,
    "ops_paper_convention": 15927808,
    "tpc_fw_name": "pytorch",
    "tpc_target_platform": "imx500",
    "tpc_version": "v1",
    "quantization_info": "<model_compression_toolkit.core.common.user_info.UserInformation object at 0x14be8d390>",
    "fp32_test_acc": 0.8514,
    "fp32_mAP": 0.9260519504342432,
    "int8_test_acc": 0.85,
    "int8_mAP": 0.9255951032335836
  },
  {
    "tag": "deeper_fp32_ptq",
    "model": "deeper",
    "checkpoint": "/Users/alexandre/Documents/ETHZ/Machine Learning on Microcontrollers FS2026/Project/ml-on-microcontrollers/pc-implementation/trained_models_2/deeper_fp32_ptq.pt",
    "output_dir": "/Users/alexandre/Documents/ETHZ/Machine Learning on Microcontrollers FS2026/Project/ml-on-microcontrollers/imx500-implementation/outputs/models/deeper_fp32_ptq",
    "export_path": "/Users/alexandre/Documents/ETHZ/Machine Learning on Microcontrollers FS2026/Project/ml-on-microcontrollers/imx500-implementation/outputs/onnx/deeper_fp32_ptq_imx500_ptq.onnx",
    "params": 141034,
    "weight_kib_fp32": 550.9140625,
    "weight_kib_int8": 137.728515625,
    "macs": 7963904,
    "ops_paper_convention": 15927808,
    "tpc_fw_name": "pytorch",
    "tpc_target_platform": "imx500",
    "tpc_version": "v1",
    "quantization_info": "<model_compression_toolkit.core.common.user_info.UserInformation object at 0x15738d690>",
    "fp32_test_acc": 0.2147,
    "fp32_mAP": 0.31872301367375355,
    "int8_test_acc": 0.2118,
    "int8_mAP": 0.3176846619270033
  },
  {
    "tag": "deeper_qat",
    "model": "deeper",
    "checkpoint": "/Users/alexandre/Documents/ETHZ/Machine Learning on Microcontrollers FS2026/Project/ml-on-microcontrollers/pc-implementation/trained_models_2/deeper_qat.pt",
    "output_dir": "/Users/alexandre/Documents/ETHZ/Machine Learning on Microcontrollers FS2026/Project/ml-on-microcontrollers/imx500-implementation/outputs/models/deeper_qat",
    "export_path": "/Users/alexandre/Documents/ETHZ/Machine Learning on Microcontrollers FS2026/Project/ml-on-microcontrollers/imx500-implementation/outputs/onnx/deeper_qat_imx500_ptq.onnx",
    "params": 141034,
    "weight_kib_fp32": 550.9140625,
    "weight_kib_int8": 137.728515625,
    "macs": 7963904,
    "ops_paper_convention": 15927808,
    "tpc_fw_name": "pytorch",
    "tpc_target_platform": "imx500",
    "tpc_version": "v1",
    "quantization_info": "<model_compression_toolkit.core.common.user_info.UserInformation object at 0x14befc9d0>",
    "fp32_test_acc": 0.8569,
    "fp32_mAP": 0.9310434395065228,
    "int8_test_acc": 0.8562,
    "int8_mAP": 0.9309254988358212
  },
  {
    "tag": "improved_fp32",
    "model": "improved",
    "checkpoint": "/Users/alexandre/Documents/ETHZ/Machine Learning on Microcontrollers FS2026/Project/ml-on-microcontrollers/pc-implementation/trained_models_2/improved_fp32.pt",
    "output_dir": "/Users/alexandre/Documents/ETHZ/Machine Learning on Microcontrollers FS2026/Project/ml-on-microcontrollers/imx500-implementation/outputs/models/improved_fp32",
    "export_path": "/Users/alexandre/Documents/ETHZ/Machine Learning on Microcontrollers FS2026/Project/ml-on-microcontrollers/imx500-implementation/outputs/onnx/improved_fp32_imx500_ptq.onnx",
    "params": 39018,
    "weight_kib_fp32": 152.4140625,
    "weight_kib_int8": 38.103515625,
    "macs": 4433920,
    "ops_paper_convention": 8867840,
    "tpc_fw_name": "pytorch",
    "tpc_target_platform": "imx500",
    "tpc_version": "v1",
    "quantization_info": "<model_compression_toolkit.core.common.user_info.UserInformation object at 0x157566c50>",
    "fp32_test_acc": 0.814,
    "fp32_mAP": 0.8990342625662386,
    "int8_test_acc": 0.8148,
    "int8_mAP": 0.8988149578968484
  },
  {
    "tag": "improved_fp32_ptq",
    "model": "improved",
    "checkpoint": "/Users/alexandre/Documents/ETHZ/Machine Learning on Microcontrollers FS2026/Project/ml-on-microcontrollers/pc-implementation/trained_models_2/improved_fp32_ptq.pt",
    "output_dir": "/Users/alexandre/Documents/ETHZ/Machine Learning on Microcontrollers FS2026/Project/ml-on-microcontrollers/imx500-implementation/outputs/models/improved_fp32_ptq",
    "export_path": "/Users/alexandre/Documents/ETHZ/Machine Learning on Microcontrollers FS2026/Project/ml-on-microcontrollers/imx500-implementation/outputs/onnx/improved_fp32_ptq_imx500_ptq.onnx",
    "params": 39018,
    "weight_kib_fp32": 152.4140625,
    "weight_kib_int8": 38.103515625,
    "macs": 4433920,
    "ops_paper_convention": 8867840,
    "tpc_fw_name": "pytorch",
    "tpc_target_platform": "imx500",
    "tpc_version": "v1",
    "quantization_info": "<model_compression_toolkit.core.common.user_info.UserInformation object at 0x169d912d0>",
    "fp32_test_acc": 0.3923,
    "fp32_mAP": 0.5258765058044066,
    "int8_test_acc": 0.3904,
    "int8_mAP": 0.5230817187666196
  },
  {
    "tag": "improved_qat",
    "model": "improved",
    "checkpoint": "/Users/alexandre/Documents/ETHZ/Machine Learning on Microcontrollers FS2026/Project/ml-on-microcontrollers/pc-implementation/trained_models_2/improved_qat.pt",
    "output_dir": "/Users/alexandre/Documents/ETHZ/Machine Learning on Microcontrollers FS2026/Project/ml-on-microcontrollers/imx500-implementation/outputs/models/improved_qat",
    "export_path": "/Users/alexandre/Documents/ETHZ/Machine Learning on Microcontrollers FS2026/Project/ml-on-microcontrollers/imx500-implementation/outputs/onnx/improved_qat_imx500_ptq.onnx",
    "params": 39018,
    "weight_kib_fp32": 152.4140625,
    "weight_kib_int8": 38.103515625,
    "macs": 4433920,
    "ops_paper_convention": 8867840,
    "tpc_fw_name": "pytorch",
    "tpc_target_platform": "imx500",
    "tpc_version": "v1",
    "quantization_info": "<model_compression_toolkit.core.common.user_info.UserInformation object at 0x1577f6d50>",
    "fp32_test_acc": 0.8191,
    "fp32_mAP": 0.9001497614218072,
    "int8_test_acc": 0.8175,
    "int8_mAP": 0.8992903585881752
  },
  {
    "tag": "mininet_fp32",
    "model": "mininet",
    "checkpoint": "/Users/alexandre/Documents/ETHZ/Machine Learning on Microcontrollers FS2026/Project/ml-on-microcontrollers/pc-implementation/trained_models_2/mininet_fp32.pt",
    "output_dir": "/Users/alexandre/Documents/ETHZ/Machine Learning on Microcontrollers FS2026/Project/ml-on-microcontrollers/imx500-implementation/outputs/models/mininet_fp32",
    "export_path": "/Users/alexandre/Documents/ETHZ/Machine Learning on Microcontrollers FS2026/Project/ml-on-microcontrollers/imx500-implementation/outputs/onnx/mininet_fp32_imx500_ptq.onnx",
    "params": 316458,
    "weight_kib_fp32": 1236.1640625,
    "weight_kib_int8": 309.041015625,
    "macs": 24478976,
    "ops_paper_convention": 48957952,
    "tpc_fw_name": "pytorch",
    "tpc_target_platform": "imx500",
    "tpc_version": "v1",
    "quantization_info": "<model_compression_toolkit.core.common.user_info.UserInformation object at 0x169f2b2d0>",
    "fp32_test_acc": 0.8863,
    "fp32_mAP": 0.9531815043737311,
    "int8_test_acc": 0.8848,
    "int8_mAP": 0.9532621615742058
  },
  {
    "tag": "mininet_fp32_ptq",
    "model": "mininet",
    "checkpoint": "/Users/alexandre/Documents/ETHZ/Machine Learning on Microcontrollers FS2026/Project/ml-on-microcontrollers/pc-implementation/trained_models_2/mininet_fp32_ptq.pt",
    "output_dir": "/Users/alexandre/Documents/ETHZ/Machine Learning on Microcontrollers FS2026/Project/ml-on-microcontrollers/imx500-implementation/outputs/models/mininet_fp32_ptq",
    "export_path": "/Users/alexandre/Documents/ETHZ/Machine Learning on Microcontrollers FS2026/Project/ml-on-microcontrollers/imx500-implementation/outputs/onnx/mininet_fp32_ptq_imx500_ptq.onnx",
    "params": 316458,
    "weight_kib_fp32": 1236.1640625,
    "weight_kib_int8": 309.041015625,
    "macs": 24478976,
    "ops_paper_convention": 48957952,
    "tpc_fw_name": "pytorch",
    "tpc_target_platform": "imx500",
    "tpc_version": "v1",
    "quantization_info": "<model_compression_toolkit.core.common.user_info.UserInformation object at 0x16c37b8d0>",
    "fp32_test_acc": 0.1301,
    "fp32_mAP": 0.13608565176271697,
    "int8_test_acc": 0.1279,
    "int8_mAP": 0.13603772604893866
  },
  {
    "tag": "mininet_qat",
    "model": "mininet",
    "checkpoint": "/Users/alexandre/Documents/ETHZ/Machine Learning on Microcontrollers FS2026/Project/ml-on-microcontrollers/pc-implementation/trained_models_2/mininet_qat.pt",
    "output_dir": "/Users/alexandre/Documents/ETHZ/Machine Learning on Microcontrollers FS2026/Project/ml-on-microcontrollers/imx500-implementation/outputs/models/mininet_qat",
    "export_path": "/Users/alexandre/Documents/ETHZ/Machine Learning on Microcontrollers FS2026/Project/ml-on-microcontrollers/imx500-implementation/outputs/onnx/mininet_qat_imx500_ptq.onnx",
    "params": 316458,
    "weight_kib_fp32": 1236.1640625,
    "weight_kib_int8": 309.041015625,
    "macs": 24478976,
    "ops_paper_convention": 48957952,
    "tpc_fw_name": "pytorch",
    "tpc_target_platform": "imx500",
    "tpc_version": "v1",
    "quantization_info": "<model_compression_toolkit.core.common.user_info.UserInformation object at 0x16c53b790>",
    "fp32_test_acc": 0.8859,
    "fp32_mAP": 0.95270646956488,
    "int8_test_acc": 0.8852,
    "int8_mAP": 0.9525931357025211
  },
  {
    "tag": "nascifarnet_fp32",
    "model": "nascifarnet",
    "checkpoint": "/Users/alexandre/Documents/ETHZ/Machine Learning on Microcontrollers FS2026/Project/ml-on-microcontrollers/pc-implementation/trained_models_2/nascifarnet_fp32.pt",
    "output_dir": "/Users/alexandre/Documents/ETHZ/Machine Learning on Microcontrollers FS2026/Project/ml-on-microcontrollers/imx500-implementation/outputs/models/nascifarnet_fp32",
    "export_path": "/Users/alexandre/Documents/ETHZ/Machine Learning on Microcontrollers FS2026/Project/ml-on-microcontrollers/imx500-implementation/outputs/onnx/nascifarnet_fp32_imx500_ptq.onnx",
    "params": 301770,
    "weight_kib_fp32": 1178.7890625,
    "weight_kib_int8": 294.697265625,
    "macs": 36180992,
    "ops_paper_convention": 72361984,
    "tpc_fw_name": "pytorch",
    "tpc_target_platform": "imx500",
    "tpc_version": "v1",
    "quantization_info": "<model_compression_toolkit.core.common.user_info.UserInformation object at 0x179e73510>",
    "fp32_test_acc": 0.8761,
    "fp32_mAP": 0.946795608283943,
    "int8_test_acc": 0.8764,
    "int8_mAP": 0.9467512211605488
  },
  {
    "tag": "nascifarnet_fp32_ptq",
    "model": "nascifarnet",
    "checkpoint": "/Users/alexandre/Documents/ETHZ/Machine Learning on Microcontrollers FS2026/Project/ml-on-microcontrollers/pc-implementation/trained_models_2/nascifarnet_fp32_ptq.pt",
    "output_dir": "/Users/alexandre/Documents/ETHZ/Machine Learning on Microcontrollers FS2026/Project/ml-on-microcontrollers/imx500-implementation/outputs/models/nascifarnet_fp32_ptq",
    "export_path": "/Users/alexandre/Documents/ETHZ/Machine Learning on Microcontrollers FS2026/Project/ml-on-microcontrollers/imx500-implementation/outputs/onnx/nascifarnet_fp32_ptq_imx500_ptq.onnx",
    "params": 301770,
    "weight_kib_fp32": 1178.7890625,
    "weight_kib_int8": 294.697265625,
    "macs": 36180992,
    "ops_paper_convention": 72361984,
    "tpc_fw_name": "pytorch",
    "tpc_target_platform": "imx500",
    "tpc_version": "v1",
    "quantization_info": "<model_compression_toolkit.core.common.user_info.UserInformation object at 0x179fce290>",
    "fp32_test_acc": 0.101,
    "fp32_mAP": 0.1545552251180474,
    "int8_test_acc": 0.1009,
    "int8_mAP": 0.15428661774040425
  },
  {
    "tag": "nascifarnet_qat",
    "model": "nascifarnet",
    "checkpoint": "/Users/alexandre/Documents/ETHZ/Machine Learning on Microcontrollers FS2026/Project/ml-on-microcontrollers/pc-implementation/trained_models_2/nascifarnet_qat.pt",
    "output_dir": "/Users/alexandre/Documents/ETHZ/Machine Learning on Microcontrollers FS2026/Project/ml-on-microcontrollers/imx500-implementation/outputs/models/nascifarnet_qat",
    "export_path": "/Users/alexandre/Documents/ETHZ/Machine Learning on Microcontrollers FS2026/Project/ml-on-microcontrollers/imx500-implementation/outputs/onnx/nascifarnet_qat_imx500_ptq.onnx",
    "params": 301770,
    "weight_kib_fp32": 1178.7890625,
    "weight_kib_int8": 294.697265625,
    "macs": 36180992,
    "ops_paper_convention": 72361984,
    "tpc_fw_name": "pytorch",
    "tpc_target_platform": "imx500",
    "tpc_version": "v1",
    "quantization_info": "<model_compression_toolkit.core.common.user_info.UserInformation object at 0x179f07ed0>",
    "fp32_test_acc": 0.8895,
    "fp32_mAP": 0.9553258711292788,
    "int8_test_acc": 0.8895,
    "int8_mAP": 0.9550614011085509
  },
  {
    "tag": "ressimplenet_fp32",
    "model": "ressimplenet",
    "checkpoint": "/Users/alexandre/Documents/ETHZ/Machine Learning on Microcontrollers FS2026/Project/ml-on-microcontrollers/pc-implementation/trained_models_2/ressimplenet_fp32.pt",
    "output_dir": "/Users/alexandre/Documents/ETHZ/Machine Learning on Microcontrollers FS2026/Project/ml-on-microcontrollers/imx500-implementation/outputs/models/ressimplenet_fp32",
    "export_path": "/Users/alexandre/Documents/ETHZ/Machine Learning on Microcontrollers FS2026/Project/ml-on-microcontrollers/imx500-implementation/outputs/onnx/ressimplenet_fp32_imx500_ptq.onnx",
    "params": 372512,
    "weight_kib_fp32": 1455.125,
    "weight_kib_int8": 363.78125,
    "macs": 18449664,
    "ops_paper_convention": 36899328,
    "tpc_fw_name": "pytorch",
    "tpc_target_platform": "imx500",
    "tpc_version": "v1",
    "quantization_info": "<model_compression_toolkit.core.common.user_info.UserInformation object at 0x16c50d950>",
    "fp32_test_acc": 0.869,
    "fp32_mAP": 0.9431276649262115,
    "int8_test_acc": 0.8697,
    "int8_mAP": 0.9426177052644068
  },
  {
    "tag": "ressimplenet_fp32_ptq",
    "model": "ressimplenet",
    "checkpoint": "/Users/alexandre/Documents/ETHZ/Machine Learning on Microcontrollers FS2026/Project/ml-on-microcontrollers/pc-implementation/trained_models_2/ressimplenet_fp32_ptq.pt",
    "output_dir": "/Users/alexandre/Documents/ETHZ/Machine Learning on Microcontrollers FS2026/Project/ml-on-microcontrollers/imx500-implementation/outputs/models/ressimplenet_fp32_ptq",
    "export_path": "/Users/alexandre/Documents/ETHZ/Machine Learning on Microcontrollers FS2026/Project/ml-on-microcontrollers/imx500-implementation/outputs/onnx/ressimplenet_fp32_ptq_imx500_ptq.onnx",
    "params": 372512,
    "weight_kib_fp32": 1455.125,
    "weight_kib_int8": 363.78125,
    "macs": 18449664,
    "ops_paper_convention": 36899328,
    "tpc_fw_name": "pytorch",
    "tpc_target_platform": "imx500",
    "tpc_version": "v1",
    "quantization_info": "<model_compression_toolkit.core.common.user_info.UserInformation object at 0x157522750>",
    "fp32_test_acc": 0.0999,
    "fp32_mAP": 0.16556049147819976,
    "int8_test_acc": 0.1,
    "int8_mAP": 0.1652083330197666
  },
  {
    "tag": "ressimplenet_qat",
    "model": "ressimplenet",
    "checkpoint": "/Users/alexandre/Documents/ETHZ/Machine Learning on Microcontrollers FS2026/Project/ml-on-microcontrollers/pc-implementation/trained_models_2/ressimplenet_qat.pt",
    "output_dir": "/Users/alexandre/Documents/ETHZ/Machine Learning on Microcontrollers FS2026/Project/ml-on-microcontrollers/imx500-implementation/outputs/models/ressimplenet_qat",
    "export_path": "/Users/alexandre/Documents/ETHZ/Machine Learning on Microcontrollers FS2026/Project/ml-on-microcontrollers/imx500-implementation/outputs/onnx/ressimplenet_qat_imx500_ptq.onnx",
    "params": 372512,
    "weight_kib_fp32": 1455.125,
    "weight_kib_int8": 363.78125,
    "macs": 18449664,
    "ops_paper_convention": 36899328,
    "tpc_fw_name": "pytorch",
    "tpc_target_platform": "imx500",
    "tpc_version": "v1",
    "quantization_info": "<model_compression_toolkit.core.common.user_info.UserInformation object at 0x14bc86210>",
    "fp32_test_acc": 0.882,
    "fp32_mAP": 0.9473591028350066,
    "int8_test_acc": 0.8832,
    "int8_mAP": 0.9470560228658144
  }
]

imx500-implementation/reports/summary.md

## Per-experiment notes

### baseline_5x5_fp32
- Model: `baseline_5x5`, optimizer: `-`, lr=?, batch_size=?, epochs=?, augment=False
- HW inference time: **1.52 ms mean, 1.52 ms p50, 1.98 ms p95**
- fp32 test acc: **79.79%**, int8 test acc: **79.83%**

### baseline_5x5_qat

- Model: `baseline_5x5`, optimizer: `-`, lr=?, batch_size=?, epochs=?, augment=False
- HW inference time: **1.52 ms mean, 1.52 ms p50, 1.97 ms p95**
- fp32 test acc: **81.14%**, int8 test acc: **81.04%**

### baseline_fp32

- Model: `baseline`, optimizer: `-`, lr=?, batch_size=?, epochs=?, augment=False
- HW inference time: **1.53 ms mean, 1.53 ms p50, 1.98 ms p95**
- fp32 test acc: **80.98%**, int8 test acc: **80.73%**

### baseline_fp32_ptq

- Model: `baseline`, optimizer: `-`, lr=?, batch_size=?, epochs=?, augment=False
- HW inference time: **1.53 ms mean, 1.53 ms p50, 1.97 ms p95**
- fp32 test acc: **80.91%**, int8 test acc: **80.77%**

### deeper_fp32_ptq

- Model: `deeper`, optimizer: `-`, lr=?, batch_size=?, epochs=?, augment=False
- HW inference time: **1.53 ms mean, 1.53 ms p50, 1.98 ms p95**
- fp32 test acc: **21.47%**, int8 test acc: **21.18%**

### deeper_qat

- Model: `deeper`, optimizer: `-`, lr=?, batch_size=?, epochs=?, augment=False
- HW inference time: **1.53 ms mean, 1.53 ms p50, 1.97 ms p95**
- fp32 test acc: **85.69%**, int8 test acc: **85.62%**

### improved_fp32_ptq

- Model: `improved`, optimizer: `-`, lr=?, batch_size=?, epochs=?, augment=False
- HW inference time: **1.52 ms mean, 1.52 ms p50, 1.98 ms p95**
- fp32 test acc: **39.23%**, int8 test acc: **39.04%**

### improved_qat

- Model: `improved`, optimizer: `-`, lr=?, batch_size=?, epochs=?, augment=False
- HW inference time: **1.53 ms mean, 1.53 ms p50, 1.97 ms p95**
- fp32 test acc: **81.91%**, int8 test acc: **81.75%**

### mininet_fp32

- Model: `mininet`, optimizer: `-`, lr=?, batch_size=?, epochs=?, augment=False
- HW inference time: **1.53 ms mean, 1.53 ms p50, 1.98 ms p95**
- fp32 test acc: **88.63%**, int8 test acc: **88.48%**

### mininet_fp32_ptq

- Model: `mininet`, optimizer: `-`, lr=?, batch_size=?, epochs=?, augment=False
- HW inference time: **1.52 ms mean, 1.52 ms p50, 1.97 ms p95**
- fp32 test acc: **13.01%**, int8 test acc: **12.79%**

### mininet_qat

- Model: `mininet`, optimizer: `-`, lr=?, batch_size=?, epochs=?, augment=False
- HW inference time: **1.53 ms mean, 1.53 ms p50, 1.97 ms p95**
- fp32 test acc: **88.59%**, int8 test acc: **88.52%**

### nascifarnet_fp32

- Model: `nascifarnet`, optimizer: `-`, lr=?, batch_size=?, epochs=?, augment=False
- HW inference time: **1.53 ms mean, 1.53 ms p50, 1.97 ms p95**
- fp32 test acc: **87.61%**, int8 test acc: **87.64%**

### ressimplenet_qat

- Model: `ressimplenet`, optimizer: `-`, lr=?, batch_size=?, epochs=?, augment=False
- HW inference time: **1.53 ms mean, 1.53 ms p50, 1.98 ms p95**
- fp32 test acc: **88.20%**, int8 test acc: **88.32%**
## Converter memory checks